{
  "scene_id": "gallery_06_event_with_instrument_RbTZfcR7k2vn",
  "version": "1.0",
  "source": {
    "kind": "hand_authored",
    "uri": "examples/gallery/06_event_with_instrument.vson"
  },
  "vson_p": "# Event with three thematic roles: agent, patient, instrument.\n# Demonstrates: punctual Event + role triadicity (the v0.1 dyadic-edge defect).\n\n(scene / Composition\n   :framedBy (cam / CameraView :angle eye_level :focalLength 35mm :framing medium_shot)\n   :viewedBy cam\n   :depicts (knight / PhysicalObject\n               :individuation Generic :animacy Agentive :countability Count\n               :class Human\n               :hasQuality (qr / Quality :dimension Role :value knight))\n   :depicts (boar / PhysicalObject\n               :individuation Generic :animacy Agentive :countability Count\n               :class Animal)\n   :depicts (sword / PhysicalObject\n               :individuation Generic :animacy Inert :countability Count\n               :class Weapon\n               :hasQuality (qm / Quality :dimension Material :value steel))\n   :occurs (strike / Event\n              :lemma strike\n              :agent knight\n              :patient boar\n              :instrument sword))\n",
  "vson_t": "@prefix vso:   <https://w3id.org/vson/v1/ontology#> .\n@prefix allen: <https://w3id.org/vson/v1/allen#> .\n@prefix rcc:   <https://w3id.org/vson/v1/rcc8#> .\n@prefix xsd:   <http://www.w3.org/2001/XMLSchema#> .\n@prefix :      <https://example.org/scenes/anonymous#> .\n\n:scene a <https://w3id.org/vson/v1/ontology#Composition> .\n:cam a <https://w3id.org/vson/v1/ontology#CameraView> .\n:cam <https://w3id.org/vson/v1/ontology#angle> \"eye_level\" .\n:cam <https://w3id.org/vson/v1/ontology#focalLength> \"35mm\" .\n:cam <https://w3id.org/vson/v1/ontology#framing> \"medium_shot\" .\n:scene <https://w3id.org/vson/v1/ontology#framedBy> :cam .\n:scene <https://w3id.org/vson/v1/ontology#viewedBy> :cam .\n:knight a <https://w3id.org/vson/v1/ontology#PhysicalObject> .\n:knight <https://w3id.org/vson/v1/ontology#individuation> <https://w3id.org/vson/v1/ontology#Generic> .\n:knight <https://w3id.org/vson/v1/ontology#animacy> <https://w3id.org/vson/v1/ontology#Agentive> .\n:knight <https://w3id.org/vson/v1/ontology#countability> <https://w3id.org/vson/v1/ontology#Count> .\n:knight <https://w3id.org/vson/v1/ontology#class> :Human .\n:qr a <https://w3id.org/vson/v1/ontology#Quality> .\n:qr <https://w3id.org/vson/v1/ontology#dimension> <https://w3id.org/vson/v1/ontology#Role> .\n:qr <https://w3id.org/vson/v1/ontology#value> :knight .\n:knight <https://w3id.org/vson/v1/ontology#hasQuality> :qr .\n:scene <https://w3id.org/vson/v1/ontology#depicts> :knight .\n:boar a <https://w3id.org/vson/v1/ontology#PhysicalObject> .\n:boar <https://w3id.org/vson/v1/ontology#individuation> <https://w3id.org/vson/v1/ontology#Generic> .\n:boar <https://w3id.org/vson/v1/ontology#animacy> <https://w3id.org/vson/v1/ontology#Agentive> .\n:boar <https://w3id.org/vson/v1/ontology#countability> <https://w3id.org/vson/v1/ontology#Count> .\n:boar <https://w3id.org/vson/v1/ontology#class> :Animal .\n:scene <https://w3id.org/vson/v1/ontology#depicts> :boar .\n:sword a <https://w3id.org/vson/v1/ontology#PhysicalObject> .\n:sword <https://w3id.org/vson/v1/ontology#individuation> <https://w3id.org/vson/v1/ontology#Generic> .\n:sword <https://w3id.org/vson/v1/ontology#animacy> <https://w3id.org/vson/v1/ontology#Inert> .\n:sword <https://w3id.org/vson/v1/ontology#countability> <https://w3id.org/vson/v1/ontology#Count> .\n:sword <https://w3id.org/vson/v1/ontology#class> :Weapon .\n:qm a <https://w3id.org/vson/v1/ontology#Quality> .\n:qm <https://w3id.org/vson/v1/ontology#dimension> <https://w3id.org/vson/v1/ontology#Material> .\n:qm <https://w3id.org/vson/v1/ontology#value> :steel .\n:sword <https://w3id.org/vson/v1/ontology#hasQuality> :qm .\n:scene <https://w3id.org/vson/v1/ontology#depicts> :sword .\n:strike a <https://w3id.org/vson/v1/ontology#Event> .\n:strike <https://w3id.org/vson/v1/ontology#lemma> \"strike\" .\n:strike <https://w3id.org/vson/v1/ontology#agent> :knight .\n:strike <https://w3id.org/vson/v1/ontology#patient> :boar .\n:strike <https://w3id.org/vson/v1/ontology#instrument> :sword .\n:scene <https://w3id.org/vson/v1/ontology#occurs> :strike .\n",
  "graph": {
    "nodes": [
      {
        "id": "scene",
        "kind": "Composition"
      },
      {
        "id": "cam",
        "kind": "CameraView",
        "properties": {
          "angle": "eye_level",
          "focalLength": "35mm",
          "framing": "medium_shot"
        }
      },
      {
        "id": "knight",
        "kind": "PhysicalObject",
        "traits": {
          "individuation": "Generic",
          "animacy": "Agentive",
          "countability": "Count"
        },
        "properties": {
          "class": "Human",
          "q_Role": "knight"
        },
        "class": "Human"
      },
      {
        "id": "boar",
        "kind": "PhysicalObject",
        "traits": {
          "individuation": "Generic",
          "animacy": "Agentive",
          "countability": "Count"
        },
        "properties": {
          "class": "Animal"
        },
        "class": "Animal"
      },
      {
        "id": "sword",
        "kind": "PhysicalObject",
        "traits": {
          "individuation": "Generic",
          "animacy": "Inert",
          "countability": "Count"
        },
        "properties": {
          "class": "Weapon",
          "q_Material": "steel"
        },
        "class": "Weapon"
      },
      {
        "id": "strike",
        "kind": "Event",
        "properties": {
          "lemma": "strike"
        }
      }
    ],
    "edges": [
      {
        "from": "scene",
        "to": "cam",
        "label": "framedBy"
      },
      {
        "from": "scene",
        "to": "cam",
        "label": "viewedBy"
      },
      {
        "from": "scene",
        "to": "knight",
        "label": "depicts"
      },
      {
        "from": "scene",
        "to": "boar",
        "label": "depicts"
      },
      {
        "from": "scene",
        "to": "sword",
        "label": "depicts"
      },
      {
        "from": "strike",
        "to": "knight",
        "label": "agent"
      },
      {
        "from": "strike",
        "to": "boar",
        "label": "patient"
      },
      {
        "from": "strike",
        "to": "sword",
        "label": "instrument"
      },
      {
        "from": "scene",
        "to": "strike",
        "label": "occurs"
      }
    ]
  },
  "conformance": {
    "conforms": true
  },
  "extraction": {
    "model": "gallery-bake",
    "prompt_version": "canonical@1.0",
    "shacl_retries": 0,
    "latency_ms": 0,
    "input_tokens": 0,
    "output_tokens": 0
  }
}
