{
  "scene_id": "gallery_07_ditransitive_TcWNpbGs6fT6",
  "version": "1.0",
  "source": {
    "kind": "hand_authored",
    "uri": "examples/gallery/07_ditransitive.vson"
  },
  "vson_p": "# Ditransitive: \"the merchant gives the apple to the child.\"\n# Demonstrates: agent + theme + recipient (the AMR :ARG0/:ARG1/:ARG2 alignment).\n\n(scene / Composition\n   :framedBy (cam / CameraView :angle eye_level :focalLength 50mm :framing medium_shot)\n   :viewedBy cam\n   :depicts (merchant / PhysicalObject\n               :individuation Generic :animacy Agentive :countability Count\n               :class Human\n               :hasQuality (qr / Quality :dimension Role :value merchant))\n   :depicts (child / PhysicalObject\n               :individuation Generic :animacy Agentive :countability Count\n               :class Human\n               :hasQuality (qa / Quality :dimension Age :value child))\n   :depicts (apple / PhysicalObject\n               :individuation Generic :animacy Inert :countability Count\n               :class Apple\n               :hasQuality (qc / Quality :dimension Color :value red))\n   :occurs (give / Event\n              :lemma give\n              :agent merchant\n              :theme apple\n              :recipient child))\n",
  "vson_t": "@prefix vso:   <https://w3id.org/vson/v1/ontology#> .\n@prefix allen: <https://w3id.org/vson/v1/allen#> .\n@prefix rcc:   <https://w3id.org/vson/v1/rcc8#> .\n@prefix xsd:   <http://www.w3.org/2001/XMLSchema#> .\n@prefix :      <https://example.org/scenes/anonymous#> .\n\n:scene a <https://w3id.org/vson/v1/ontology#Composition> .\n:cam a <https://w3id.org/vson/v1/ontology#CameraView> .\n:cam <https://w3id.org/vson/v1/ontology#angle> \"eye_level\" .\n:cam <https://w3id.org/vson/v1/ontology#focalLength> \"50mm\" .\n:cam <https://w3id.org/vson/v1/ontology#framing> \"medium_shot\" .\n:scene <https://w3id.org/vson/v1/ontology#framedBy> :cam .\n:scene <https://w3id.org/vson/v1/ontology#viewedBy> :cam .\n:merchant a <https://w3id.org/vson/v1/ontology#PhysicalObject> .\n:merchant <https://w3id.org/vson/v1/ontology#individuation> <https://w3id.org/vson/v1/ontology#Generic> .\n:merchant <https://w3id.org/vson/v1/ontology#animacy> <https://w3id.org/vson/v1/ontology#Agentive> .\n:merchant <https://w3id.org/vson/v1/ontology#countability> <https://w3id.org/vson/v1/ontology#Count> .\n:merchant <https://w3id.org/vson/v1/ontology#class> :Human .\n:qr a <https://w3id.org/vson/v1/ontology#Quality> .\n:qr <https://w3id.org/vson/v1/ontology#dimension> <https://w3id.org/vson/v1/ontology#Role> .\n:qr <https://w3id.org/vson/v1/ontology#value> :merchant .\n:merchant <https://w3id.org/vson/v1/ontology#hasQuality> :qr .\n:scene <https://w3id.org/vson/v1/ontology#depicts> :merchant .\n:child a <https://w3id.org/vson/v1/ontology#PhysicalObject> .\n:child <https://w3id.org/vson/v1/ontology#individuation> <https://w3id.org/vson/v1/ontology#Generic> .\n:child <https://w3id.org/vson/v1/ontology#animacy> <https://w3id.org/vson/v1/ontology#Agentive> .\n:child <https://w3id.org/vson/v1/ontology#countability> <https://w3id.org/vson/v1/ontology#Count> .\n:child <https://w3id.org/vson/v1/ontology#class> :Human .\n:qa a <https://w3id.org/vson/v1/ontology#Quality> .\n:qa <https://w3id.org/vson/v1/ontology#dimension> <https://w3id.org/vson/v1/ontology#Age> .\n:qa <https://w3id.org/vson/v1/ontology#value> :child .\n:child <https://w3id.org/vson/v1/ontology#hasQuality> :qa .\n:scene <https://w3id.org/vson/v1/ontology#depicts> :child .\n:apple a <https://w3id.org/vson/v1/ontology#PhysicalObject> .\n:apple <https://w3id.org/vson/v1/ontology#individuation> <https://w3id.org/vson/v1/ontology#Generic> .\n:apple <https://w3id.org/vson/v1/ontology#animacy> <https://w3id.org/vson/v1/ontology#Inert> .\n:apple <https://w3id.org/vson/v1/ontology#countability> <https://w3id.org/vson/v1/ontology#Count> .\n:apple <https://w3id.org/vson/v1/ontology#class> :Apple .\n:qc a <https://w3id.org/vson/v1/ontology#Quality> .\n:qc <https://w3id.org/vson/v1/ontology#dimension> <https://w3id.org/vson/v1/ontology#Color> .\n:qc <https://w3id.org/vson/v1/ontology#value> :red .\n:apple <https://w3id.org/vson/v1/ontology#hasQuality> :qc .\n:scene <https://w3id.org/vson/v1/ontology#depicts> :apple .\n:give a <https://w3id.org/vson/v1/ontology#Event> .\n:give <https://w3id.org/vson/v1/ontology#lemma> \"give\" .\n:give <https://w3id.org/vson/v1/ontology#agent> :merchant .\n:give <https://w3id.org/vson/v1/ontology#theme> :apple .\n:give <https://w3id.org/vson/v1/ontology#recipient> :child .\n:scene <https://w3id.org/vson/v1/ontology#occurs> :give .\n",
  "graph": {
    "nodes": [
      {
        "id": "scene",
        "kind": "Composition"
      },
      {
        "id": "cam",
        "kind": "CameraView",
        "properties": {
          "angle": "eye_level",
          "focalLength": "50mm",
          "framing": "medium_shot"
        }
      },
      {
        "id": "merchant",
        "kind": "PhysicalObject",
        "traits": {
          "individuation": "Generic",
          "animacy": "Agentive",
          "countability": "Count"
        },
        "properties": {
          "class": "Human",
          "q_Role": "merchant"
        },
        "class": "Human"
      },
      {
        "id": "child",
        "kind": "PhysicalObject",
        "traits": {
          "individuation": "Generic",
          "animacy": "Agentive",
          "countability": "Count"
        },
        "properties": {
          "class": "Human",
          "q_Age": "child"
        },
        "class": "Human"
      },
      {
        "id": "apple",
        "kind": "PhysicalObject",
        "traits": {
          "individuation": "Generic",
          "animacy": "Inert",
          "countability": "Count"
        },
        "properties": {
          "class": "Apple",
          "q_Color": "red"
        },
        "class": "Apple"
      },
      {
        "id": "give",
        "kind": "Event",
        "properties": {
          "lemma": "give"
        }
      }
    ],
    "edges": [
      {
        "from": "scene",
        "to": "cam",
        "label": "framedBy"
      },
      {
        "from": "scene",
        "to": "cam",
        "label": "viewedBy"
      },
      {
        "from": "scene",
        "to": "merchant",
        "label": "depicts"
      },
      {
        "from": "scene",
        "to": "child",
        "label": "depicts"
      },
      {
        "from": "scene",
        "to": "apple",
        "label": "depicts"
      },
      {
        "from": "give",
        "to": "merchant",
        "label": "agent"
      },
      {
        "from": "give",
        "to": "apple",
        "label": "theme"
      },
      {
        "from": "give",
        "to": "child",
        "label": "recipient"
      },
      {
        "from": "scene",
        "to": "give",
        "label": "occurs"
      }
    ]
  },
  "conformance": {
    "conforms": true
  },
  "extraction": {
    "model": "gallery-bake",
    "prompt_version": "canonical@1.0",
    "shacl_retries": 0,
    "latency_ms": 0,
    "input_tokens": 0,
    "output_tokens": 0
  }
}
