{
  "scene_id": "gallery_03_spatial_topology_M3Bfkx253UDf",
  "version": "1.0",
  "source": {
    "kind": "hand_authored",
    "uri": "examples/gallery/03_spatial_topology.vson"
  },
  "vson_p": "# RCC-8 topological relation (no viewer needed for non-directional facts).\n# Demonstrates: SpatialFact with rcc only (cat externally connected to mat).\n\n(scene / Composition\n   :framedBy (cam / CameraView :angle eye_level :focalLength 50mm :framing medium_shot)\n   :viewedBy cam\n   :depicts (cat / PhysicalObject\n               :individuation Generic :animacy Agentive :countability Count\n               :class Animal)\n   :depicts (mat / PhysicalObject\n               :individuation Generic :animacy Inert :countability Count\n               :class Furniture)\n   :hasFact (sf / SpatialFact\n               :figure cat\n               :ground mat\n               :rcc EC))\n",
  "vson_t": "@prefix vso:   <https://vson.dev/v1/ontology#> .\n@prefix allen: <https://vson.dev/v1/allen#> .\n@prefix rcc:   <https://vson.dev/v1/rcc8#> .\n@prefix xsd:   <http://www.w3.org/2001/XMLSchema#> .\n@prefix :      <https://example.org/scenes/anonymous#> .\n\n:scene a <https://vson.dev/v1/ontology#Composition> .\n:cam a <https://vson.dev/v1/ontology#CameraView> .\n:cam <https://vson.dev/v1/ontology#angle> \"eye_level\" .\n:cam <https://vson.dev/v1/ontology#focalLength> \"50mm\" .\n:cam <https://vson.dev/v1/ontology#framing> \"medium_shot\" .\n:scene <https://vson.dev/v1/ontology#framedBy> :cam .\n:scene <https://vson.dev/v1/ontology#viewedBy> :cam .\n:cat a <https://vson.dev/v1/ontology#PhysicalObject> .\n:cat <https://vson.dev/v1/ontology#individuation> <https://vson.dev/v1/ontology#Generic> .\n:cat <https://vson.dev/v1/ontology#animacy> <https://vson.dev/v1/ontology#Agentive> .\n:cat <https://vson.dev/v1/ontology#countability> <https://vson.dev/v1/ontology#Count> .\n:cat <https://vson.dev/v1/ontology#class> :Animal .\n:scene <https://vson.dev/v1/ontology#depicts> :cat .\n:mat a <https://vson.dev/v1/ontology#PhysicalObject> .\n:mat <https://vson.dev/v1/ontology#individuation> <https://vson.dev/v1/ontology#Generic> .\n:mat <https://vson.dev/v1/ontology#animacy> <https://vson.dev/v1/ontology#Inert> .\n:mat <https://vson.dev/v1/ontology#countability> <https://vson.dev/v1/ontology#Count> .\n:mat <https://vson.dev/v1/ontology#class> :Furniture .\n:scene <https://vson.dev/v1/ontology#depicts> :mat .\n:sf a <https://vson.dev/v1/ontology#SpatialFact> .\n:sf <https://vson.dev/v1/ontology#figure> :cat .\n:sf <https://vson.dev/v1/ontology#ground> :mat .\n:sf <https://vson.dev/v1/ontology#rcc> <https://vson.dev/v1/rcc8#EC> .\n:scene <https://vson.dev/v1/ontology#hasFact> :sf .\n",
  "graph": {
    "nodes": [
      {
        "id": "scene",
        "kind": "Composition"
      },
      {
        "id": "cam",
        "kind": "CameraView",
        "properties": {
          "angle": "eye_level",
          "focalLength": "50mm",
          "framing": "medium_shot"
        }
      },
      {
        "id": "cat",
        "kind": "PhysicalObject",
        "traits": {
          "individuation": "Generic",
          "animacy": "Agentive",
          "countability": "Count"
        },
        "properties": {
          "class": "Animal"
        },
        "class": "Animal"
      },
      {
        "id": "mat",
        "kind": "PhysicalObject",
        "traits": {
          "individuation": "Generic",
          "animacy": "Inert",
          "countability": "Count"
        },
        "properties": {
          "class": "Furniture"
        },
        "class": "Furniture"
      },
      {
        "id": "sf",
        "kind": "SpatialFact",
        "properties": {
          "rcc": "EC"
        }
      }
    ],
    "edges": [
      {
        "from": "scene",
        "to": "cam",
        "label": "framedBy"
      },
      {
        "from": "scene",
        "to": "cam",
        "label": "viewedBy"
      },
      {
        "from": "scene",
        "to": "cat",
        "label": "depicts"
      },
      {
        "from": "scene",
        "to": "mat",
        "label": "depicts"
      },
      {
        "from": "sf",
        "to": "cat",
        "label": "figure"
      },
      {
        "from": "sf",
        "to": "mat",
        "label": "ground"
      },
      {
        "from": "scene",
        "to": "sf",
        "label": "hasFact"
      }
    ]
  },
  "conformance": {
    "conforms": true
  },
  "extraction": {
    "model": "gallery-bake",
    "prompt_version": "canonical@1.0",
    "shacl_retries": 0,
    "latency_ms": 0,
    "input_tokens": 0,
    "output_tokens": 0
  }
}
