{
  "scene_id": "gallery_09_mass_substance_GYvBd243RpJb",
  "version": "1.0",
  "source": {
    "kind": "hand_authored",
    "uri": "examples/gallery/09_mass_substance.vson"
  },
  "vson_p": "# Mass / Substance: water pouring -- countability=Mass, no Count.\n# Demonstrates: Substance class + countability=Mass + a Process (durative).\n\n(scene / Composition\n   :framedBy (cam / CameraView :angle eye_level :focalLength 85mm :framing close_up)\n   :viewedBy cam\n   :depicts (jug / PhysicalObject\n               :individuation Generic :animacy Inert :countability Count\n               :class Vessel\n               :hasQuality (qm / Quality :dimension Material :value ceramic))\n   :depicts (water / Substance\n               :individuation Generic\n               :animacy Inert\n               :countability Mass\n               :class Water)\n   :occurs (pour / Process\n              :lemma pour\n              :agent jug\n              :theme water))\n",
  "vson_t": "@prefix vso:   <https://vson.dev/v1/ontology#> .\n@prefix allen: <https://vson.dev/v1/allen#> .\n@prefix rcc:   <https://vson.dev/v1/rcc8#> .\n@prefix xsd:   <http://www.w3.org/2001/XMLSchema#> .\n@prefix :      <https://example.org/scenes/anonymous#> .\n\n:scene a <https://vson.dev/v1/ontology#Composition> .\n:cam a <https://vson.dev/v1/ontology#CameraView> .\n:cam <https://vson.dev/v1/ontology#angle> \"eye_level\" .\n:cam <https://vson.dev/v1/ontology#focalLength> \"85mm\" .\n:cam <https://vson.dev/v1/ontology#framing> \"close_up\" .\n:scene <https://vson.dev/v1/ontology#framedBy> :cam .\n:scene <https://vson.dev/v1/ontology#viewedBy> :cam .\n:jug a <https://vson.dev/v1/ontology#PhysicalObject> .\n:jug <https://vson.dev/v1/ontology#individuation> <https://vson.dev/v1/ontology#Generic> .\n:jug <https://vson.dev/v1/ontology#animacy> <https://vson.dev/v1/ontology#Inert> .\n:jug <https://vson.dev/v1/ontology#countability> <https://vson.dev/v1/ontology#Count> .\n:jug <https://vson.dev/v1/ontology#class> :Vessel .\n:qm a <https://vson.dev/v1/ontology#Quality> .\n:qm <https://vson.dev/v1/ontology#dimension> <https://vson.dev/v1/ontology#Material> .\n:qm <https://vson.dev/v1/ontology#value> :ceramic .\n:jug <https://vson.dev/v1/ontology#hasQuality> :qm .\n:scene <https://vson.dev/v1/ontology#depicts> :jug .\n:water a <https://vson.dev/v1/ontology#Substance> .\n:water <https://vson.dev/v1/ontology#individuation> <https://vson.dev/v1/ontology#Generic> .\n:water <https://vson.dev/v1/ontology#animacy> <https://vson.dev/v1/ontology#Inert> .\n:water <https://vson.dev/v1/ontology#countability> <https://vson.dev/v1/ontology#Mass> .\n:water <https://vson.dev/v1/ontology#class> :Water .\n:scene <https://vson.dev/v1/ontology#depicts> :water .\n:pour a <https://vson.dev/v1/ontology#Process> .\n:pour <https://vson.dev/v1/ontology#lemma> \"pour\" .\n:pour <https://vson.dev/v1/ontology#agent> :jug .\n:pour <https://vson.dev/v1/ontology#theme> :water .\n:scene <https://vson.dev/v1/ontology#occurs> :pour .\n",
  "graph": {
    "nodes": [
      {
        "id": "scene",
        "kind": "Composition"
      },
      {
        "id": "cam",
        "kind": "CameraView",
        "properties": {
          "angle": "eye_level",
          "focalLength": "85mm",
          "framing": "close_up"
        }
      },
      {
        "id": "jug",
        "kind": "PhysicalObject",
        "traits": {
          "individuation": "Generic",
          "animacy": "Inert",
          "countability": "Count"
        },
        "properties": {
          "class": "Vessel",
          "q_Material": "ceramic"
        },
        "class": "Vessel"
      },
      {
        "id": "water",
        "kind": "Substance",
        "traits": {
          "individuation": "Generic",
          "animacy": "Inert",
          "countability": "Mass"
        },
        "properties": {
          "class": "Water"
        },
        "class": "Water"
      },
      {
        "id": "pour",
        "kind": "Process",
        "properties": {
          "lemma": "pour"
        }
      }
    ],
    "edges": [
      {
        "from": "scene",
        "to": "cam",
        "label": "framedBy"
      },
      {
        "from": "scene",
        "to": "cam",
        "label": "viewedBy"
      },
      {
        "from": "scene",
        "to": "jug",
        "label": "depicts"
      },
      {
        "from": "scene",
        "to": "water",
        "label": "depicts"
      },
      {
        "from": "pour",
        "to": "jug",
        "label": "agent"
      },
      {
        "from": "pour",
        "to": "water",
        "label": "theme"
      },
      {
        "from": "scene",
        "to": "pour",
        "label": "occurs"
      }
    ]
  },
  "conformance": {
    "conforms": true
  },
  "extraction": {
    "model": "gallery-bake",
    "prompt_version": "canonical@1.0",
    "shacl_retries": 0,
    "latency_ms": 0,
    "input_tokens": 0,
    "output_tokens": 0
  }
}
